{
  "name": "chaining_hash_map_basic",
  "structure": "ChainingHashMap",
  "notes": "keys() is always sorted so bucket ordering is never observable.",
  "ops": [
    { "op": "construct", "args": [] },
    { "op": "set", "args": ["a", 1], "expect": { "size": 1 } },
    { "op": "set", "args": ["b", 2], "expect": { "size": 2 } },
    { "op": "set", "args": ["c", 3], "expect": { "size": 3 } },
    { "op": "get", "args": ["a"], "expect": { "value": 1 } },
    { "op": "get", "args": ["z"], "expect": { "value": null } },
    { "op": "has", "args": ["b"], "expect": { "contains": true } },
    { "op": "has", "args": ["z"], "expect": { "contains": false } },
    { "op": "delete", "args": ["b"], "expect": { "value": true, "size": 2 } },
    { "op": "delete", "args": ["z"], "expect": { "value": false, "size": 2 } },
    { "op": "keys", "expect": { "list": ["a", "c"] } },
    { "op": "set", "args": ["a", 100], "expect": { "size": 2 } },
    { "op": "get", "args": ["a"], "expect": { "value": 100 } },
    { "op": "keys", "expect": { "list": ["a", "c"] } },
    { "op": "set", "args": ["m", 5], "expect": { "size": 3 } },
    { "op": "set", "args": ["n", 6], "expect": { "size": 4 } },
    { "op": "set", "args": ["o", 7], "expect": { "size": 5 } },
    { "op": "set", "args": ["p", 8], "expect": { "size": 6 } },
    { "op": "set", "args": ["q", 9], "expect": { "size": 7 } },
    { "op": "keys", "expect": { "list": ["a", "c", "m", "n", "o", "p", "q"] } },
    { "op": "size", "expect": { "value": 7 } }
  ]
}
